Rank,Name,Breed,Gender,Age,End_Of_Watch,Day_Of_Week,Cause,Department,State,Tour,Weapon,Offender,Summary
K9,Max,Unknown Breed,Male,,1999-09-09,Thursday,Gunfire,"Beaver County Sheriff's Office, Utah",Utah,,Rifle; .223 caliber,Convicted,"K9 Max was shot and killed as he and his handler searched a 640-acre compound that had been sold at auction after the owner had failed to pay taxes.The compound's owner was the leader of a religious separatist group that used the compound. As the deputies cleared the compound they were confronted by the man, who opened fire on them with a .223 caliber rifle. K9 Max was severely wounded while his handler was critically wounded.The subject was eventually arrested and convicted of shooting Max's handler."
K9,Baltimore,German Shepherd,Male,5.0,1999-07-15,Thursday,Automobile crash,"Dallas Police Department, Texas",Texas,2 years,,,K9 Balti was killed when the police vehicle he was in was struck by a vehicle on I-35 East at the Laureland Road exit.K9 Balti and his handler were helping a stranded motorist when their vehicle was struck. Bystanders were able to rescue K9 Balti and his partner before the police vehicle caught fire. K9 Balti died at the scene.K9 Balti served with the Dallas Police Department for two years.
K9,Sabre,Unknown Breed,Male,,1999-01-23,Saturday,Gunfire,"Lansing Police Department, Michigan",Michigan,,Gun; Unknown type,Shot and killed,K9 Sabre was shot and killed while attempting to take down an armed subject following a foot pursuit.The subject had broken into the basement of an occupied home while attempting to flee officers. Officers attempted to talk the man into exiting the home but he refused to do so. As entry was made into the home the subject opened fire. Sabre immediately attacked the subject as officers returned fire. Both Sabre and the subject were fatally wounding during the exchange.
K9,Ringo,Unknown Breed,,,1999-08-12,Thursday,Struck by vehicle,"Arizona Department of Public Safety, Arizona",Arizona,,,,K9 Ringo was struck and killed by a vehicle on State Route 77 while off his leash as he and his handler took a break.
K9,Trax,Unknown Breed,,,1999-10-08,Friday,Duty related illness,"Miami-Dade Police Department, Florida",Florida,,,,K9 Trax died when a tumor around his heart burst as he was actively engaging a robbery suspect in the area of NW 46th Street and 25th Avenue.
K9,Quanto,Unknown Breed,,,1999-06-17,Thursday,Gunfire,"Jacksonville Sheriff's Office, Florida",Florida,,Gun; Unknown type,,K9 Quanto was shot and killed while attempting to apprehend an escapee from the Duval County Jail.
K9,Copper,Unknown Breed,,,1999-11-16,Tuesday,Gunfire,"Clay County Sheriff's Office, Kansas",Kansas,,Gun; Unknown type,,"K9 Copper and Deputy Sheriff James Kenney were shot and killed as they assisted other officers arrest a jail escapee.The suspect and two other inmates overpowered two corrections officers and escaped from a local jail. The two other inmates were arrested soon thereafter, however, the suspect escaped to his home. Deputy Kenney, and his canine Copper, went to the house to arrest him and was met with gunfire. Both he and Copper were shot and killed.The suspect was then arrested by other officers and charged with premeditated first-degree murder and with inflicting death on a police dog."
K9,Titan,German Shepherd,Male,4.0,1999-07-10,Saturday,Gunfire,"Jacksonville Sheriff's Office, Florida",Florida,,Handgun,Shot and killed,"K9 Titan was shot and killed after being released on an armed subject following a vehicle pursuit.The pursuit started after an officer made a traffic stop on the vehicle. As the officer waited for backup the vehicle fled and was pursued for several miles until stopping at the end of Colfax Court. One of the occupants of the car immediately exited the vehicle holding a handgun, at which point Titan was released. The subject fatally shot Titan and then fired at the officers, who returned fire and killed him.K9 Titan had served with the Jacksonville Sheriff's Office for two years."
K9,Valco,Belgian Malinois,Male,,2000-07-17,Monday,Gunfire,"Indianapolis Police Department, Indiana",Indiana,,Officer's handgun,,"K9 Valco was accidentally shot and killed by another officer during a drug raid on a home in the 3400 block of North Kenwood Avenue.As K9 Valco and his handler were on the rear of the house his handler stumbled and dropped his leash. K9 Valco ran towards the front of the house where a fellow officer who could not identify him as a police canine shot him three times, killing him.K9 Valco served with the Indianapolis Police Department for one year."
K9,Erny,German Shepherd,Male,3.0,2000-10-12,Thursday,Gunfire,"Escambia County Sheriff's Office, Florida",Florida,"1 year, 5 months",Handgun,Shot and killed,"K9 Erny was shot and killed while attempting an apprehension on an armed subject wanted for robbing a cab driver earlier in the evening.The subject had been tracked by K9 Erny through several yards until the man went through the perimeter that had been set up. K9 Erny continued tracking the man to a vacant lot near the intersection of Massachusetts Avenue and Kelly Avenue. As K9 Erny, his handler, and backup officer entered the lot the man stood up from his concealed position in high weeds and pointed a revolver at the officers. K9 Erny was deployed for an apprehension but was shot in the chest.His handler was then shot in the leg during the ensuing struggle before the backup officer shot and killed the subject.K9 Erny had served with the Escambia County Sheriff's Office for 17 months."
K9,Atlas,Unknown Breed,,,2000-07-23,Sunday,Gunfire,"Miami Police Department, Florida",Florida,,Gun; Unknown type,,K9 Atlas was shot and killed by a robbery suspect in the area of NW 36th Street and 17th Avenue.
K9,Cero,Unknown Breed,,,2000-03-25,Saturday,Gunfire,"Ashtabula County Sheriff's Department, Ohio",Ohio,,Handgun; .22 caliber,Shot and killed,"K9 Cero was shot and killed after being released on a suspect in an active shooter incident.The subject had thrown down a shotgun and started to flee on foot when Cero was deployed. As Cero bit him the man opened fire with a .22 caliber revolver, killing Cero.Officers on scene returned fire, killing the man."
K9,Tramp,Unknown Breed,Male,6.0,2000-10-20,Friday,Struck by vehicle,"Plymouth Township Police Department, Pennsylvania",Pennsylvania,,,,K9 Tramp was struck and killed by a vehicle as he and his handler investigated an alarm call.
K9,Colt,German Shepherd,Male,,2000-06-25,Sunday,Gunfire (Inadvertent),"Chesterfield County Police Department, Virginia",Virginia,5 years,Gun; Unknown type,,"K9 Colt was shot and killed by a police officer after mistakenly biting the officer during a pursuit.The suspect had led officers on a vehicle pursuit until bailing out on foot in a cul-de-sac. K9 Colt was released to apprehend the suspect, but mistakenly bit another officer who was also chasing the subject. The officer shot K9 Colt after being bitten on the arms and legs multiple times.K9 Colt had served with the Chesterfield County Police Department for five years."
K9,Maverick,German Shepherd,,6.0,2000-02-12,Saturday,Struck by vehicle,"Sonoma County Sheriff's Office, California",California,4 years,,,K9 Maverick was struck and killed by a vehicle while pursuing two suspects who had fled on foot following a traffic stop during the graveyard shift.
K9,Ando,German Shepherd,Male,,2000-12-26,Tuesday,Drowned,"LaGrange Police Department, Georgia",Georgia,,,Convicted,K9 Ando drowned while searching for a subject who fled following a vehicle pursuit and foot pursuit.Ando and his handler were searching a heavily wooded area when Ando became separated. His body was found the following morning in a nearby canal.The subject was later apprehended and showed signs that he had been in a struggle with Ando. He was convicted of Ando's death.
K9,Falco,Belgian Malinois,Male,,2000-02-18,Friday,Gunfire,"Jackson County Sheriff's Office, Kansas",Kansas,,Gun; Unknown type,Committed suicide,"K9 Falco was shot and killed by a subject who had just shot his handler.His handler had responded to a residence to perform a welfare check. As soon as he knocked on the door an occupant inside opened fire with a shotgun, striking him twice in the upper body. The deputy retreated to a nearby woodline and called for assistance.As he waited for backup the subject exited the home, approached his cruiser, and shot K9 Falco inside of his kennel.The subject barricaded himself inside his home for approximately two hours before committing suicide."
K9,Ivan,German Shepherd,,,2001-03-02,Friday,Fall,"Sacramento Police Department, California",California,3 years,,,K9 Ivan was killed when he fell from the roof of a two-story building.K9 Ivan had served with the Sacramento Police Department for three years and was credited with apprehending of over 50 suspects.
K9,Buddy,German Shepherd,Male,,2001-07-30,Monday,Gunfire,"Bremerton Police Department, Washington",Washington,,Gun; Unknown type,Sentenced to 7 years,"K9 Buddy was shot and killed after he and his handler responded to reports of gunshots from a city park.Upon searching the area they located two subjects hiding in bushes. Both men tried to run as the officers attempted to arrest them. One of the subject opened fire, shooting Buddy. His handler returned fire, wounding the subject. The man was later convicted of charges in the case and sentenced to seven years."
K9,Ferro,German Shepherd,Male,5.0,2001-12-14,Friday,Struck by vehicle,"Pierce County Sheriff's Department, Washington",Washington,,,,K9 Ferro was struck and killed by a patrol car as he chased a subject who fled during a traffic stop.K9 Ferro's handler had conducted a traffic stop near the intersection of 112th Street and Pacific Avenue in Parkland. The driver fled across the street into a gas station. As K9 Ferro chased the subject he was struck by a patrol car responding to the scene.
K9,Hugo,Unknown Breed,,,2001-10-01,Monday,Heatstroke,"Arizona Department of Public Safety, Arizona",Arizona,,,,"K-9 Hugo died of heat exhaustion after being left for a period of time in his handler's vehicle.  K-9 Hugo's handler was attending a training class for his Department. He left his K-9 Hugo in their patrol vehicle with the air conditioning running. After approximately 40 minutes, the officer returned to his vehicle to check on his partner. He discovered that the air conditioner had malfunctioned and stopped running. Hugo died in the vehicle of heat stroke."
K9,Sirius,Labrador Retriever,Male,4.0,2001-09-11,Tuesday,Terrorist attack,"Port Authority of New York and New Jersey Police Department, New York",New York,"1 year, 2 months",Aircraft; Passenger jet,,"K9 Sirius died in the terrorist attacks of September 11, 2001.  K9 Sirius was in K9 headquarters with his handler when the first plane struck the World Trade Center.  His handler put him in his cage to investigate, and was unable to return before the building collapsed.On the morning of September 11, 2001, seventy-two officers from a total of eight local, state, and federal agencies were killed when terrorist hijackers working for the al Qaeda terrorist network, headed by Osama bin Laden, crashed two of four hijacked planes into the World Trade Center towers in New York City. After the impact of the first plane, putting the safety of others before their own, law enforcement officers along with fire and EMS personnel, rushed to the burning Twin Towers of the World Trade Center to aid the victims and lead them to safety. Due to their quick actions, it is estimated that over 25,000 people were saved.As the evacuation continued, the first tower unexpectedly collapsed due as a result of the intense fire caused by the impact. The second tower collapsed a short time later. 71 law enforcement officers, 343 members of the New York City Fire Department, 1 police K9 and over 2,800 civilians were killed at the World Trade Center site.A third hijacked plane crashed into a field in rural Pennsylvania when the passengers attempted to re-take control of the plane. One law enforcement officer, who was a passenger on the plane, was killed in that crash.The fourth hijacked plane was crashed into the Pentagon in Arlington, Virginia, killing almost 200 military and civilian personnel. No law enforcement officers were killed at the Pentagon.The terrorist attacks resulted in the declaration of war against the Taliban regime, the illegal rulers of Afghanistan, and the al Qaeda terrorist network which also was based in Afghanistan.On September 9, 2005, all of the public safety officers killed on September 11, 2001, were posthumously awarded the 9/11 Heroes Medal of Valor by President George W. Bush.The contamination in the air at the World Trade Center site caused many rescue personnel to become extremely ill, and eventually led to the death of several rescue workers.On May 1, 2011 members of the United States military conducted a raid on a compound in Abbottabad, Pakistan where Osama bin Laden was hiding. During the raid, they shot and killed bin Laden."
K9,Rocco,German Shepherd,Male,3.0,2001-05-16,Wednesday,Fall,"Long Beach Police Department, California",California,4 months,,,K9 Rocco died as a result of the injuries he sustained in a fall.  Rocco had pursued subjects onto the roof of the Museum of Latin American Art and jumped from the roof while in pursuit.  Rocco was left paralyzed with a broken back and was euthanized two days later.
K9,Zeus,Dutch Shepherd,Male,2.0,2002-10-27,Sunday,Gunfire,"Indianapolis Police Department, Indiana",Indiana,,Officer's handgun,,"K9 Zeus was shot and killed by another officer after he attacked the officer during a traffic stop.K9 Zeus and his handler responded to the 3700 block of Rural Street to assist an officer with a search of a vehicle after a suspect fled from the officer. While at the scene one of the subjects from the stop hit K9 Zeus with a lawn chair and was taken into custody by K9 Zeus' handler.K9 Zeus, who was not on a leash while searching the vehicle, then attacked the officer who had his gun drawn.The subject who assaulted K9 Zeus was charged with resisting arrest, auto theft, and assault and battery on a law enforcement animal.K9 Zeus had served with the Indianapolis Police Department for two months."
K9,Fax,German Shepherd,Male,,2002-04-23,Tuesday,Animal related,"Lake County Sheriff's Department, Indiana",Indiana,,,Charged,"K9 Fax died after being attacked by a pit bull while protecting his handler and another officer.The two officers were checking a wooded area commonly used to dump stolen vehicles when they observed a man sitting in a car. As they approached the subject the man suddenly turned on the lights and drove towards the officers, who ordered him to stop at gunpoint. As they attempted to talk to the subject, the man let his pitbull out of the vehicle. The pitbull was put back into the truck upon instructions from the officers.As the officers attempted to place the subject under arrest he began to struggle and again ordered the pitbull out of the truck. As it attempted to attack the officers, K9 Fax intercepted it kept it from the officers, but suffered serious injuries. Fax's handler was able to fatally shoot the pitbull. Fax was taken to animal hospital where he underwent surgery, but died a short time later from complications.K9 Fax had served with the Lake County Sheriff's Department for six years."
K9,Zucco,Belgian Malinois,Male,4.0,2002-10-30,Wednesday,Gunfire,"New Orleans Police Department, Louisiana",Louisiana,,Handgun,Charged with bank robbery,K9 Zucco was shot and killed while tracking two armed bank robbery suspects at a home near the intersection of Memphis Street and Walker Street.Officers with the Lakeshore Crime Prevention District spotted both suspects on foot in the 800 block of Turquoise Street. One suspect was arrested and the second suspect evaded officers during a foot pursuit. K9 Zucco quickly picked up the suspect's scent during a yard to yard track and lead police to the man hiding underneath a home. K9 Zucco was shot and killed as he went underneath the home in an attempt to apprehend the subject.The man remained barricaded underneath the home for several hours before surrendering.The man was charged with federal bank robbery offenses and charged under the state code sections for killing K9 Zucco.
K9,Jambo,German Shepherd,Male,10.0,2002-02-08,Friday,Assault,"San Leandro Police Department, California",California,8 years,Person,,"On February 7th, 2002, K9 Jambo's handler made a traffic stop on a theft suspect in East Oakland. The suspect fled on foot and was pursued by Jambo who caught up with the suspect attempting to jump over a fence. Jambo pulled down the suspect and detained him until the arrival of his handler. The suspect was then taken in to custody after a brief struggle.Jambo was taken to the vet the following day due to signs of being injured in the struggle. Jambo was found to have a ruptured spline which was not operable, he was euthanized that same day."
K9,Rudy,Belgian Malinois,Male,4.0,2002-04-19,Friday,Stabbed,"Oxnard Police Department, California",California,2 years,Edged weapon; Knife,Arrested,"K9 Rudy was stabbed to death while apprehending a suspect who fled on foot during a traffic stop.K9 Rudy had served with the Oxnard Police Department for two years and was credited with assisting with 3,000 arrests."
K9,Rik,Belgian Malinois,Male,2.0,2002-06-05,Wednesday,Gunfire,"Bonneville County Sheriff's Office, Idaho",Idaho,,Handgun,Committed suicide,K9 Rik was shot and killed while attempting to apprehend a subject who had abducted a 14-year-old girl.The girl was able to escape from the subject and provided authorities with information about the subject's identity. A warrant was obtained for the man and the SWAT team was mobilized to serve it.The subject was located and lead officers on a three-county pursuit before driving onto a dead-end Forest Service road. K9 Rik was deployed as the subject fled on foot. As Rik bit the subject the man pulled out a gun and shot him and a deputy. The man committed suicide as deputies returned fire.
K9,Rudi,Belgian Malinois,Male,2.0,2002-04-01,Monday,Automobile crash,"Las Vegas Metropolitan Police Department, Nevada",Nevada,,,,K9 Rudi succumbed to injuries sustained three days earlier when the police vehicle he was riding in was struck by another vehicle.K9 Rudi and his handler were responding to a request for assistance from the canine unit to track an armed man who had fled from police on foot. K9 Rudi's handler had the emergency equipment activated when the police vehicle was struck by another vehicle at the intersection of Nellis Boulevard and Stewart Avenue. K9 Rudi suffered a fractured and dislocated hip and was permanently paralyzed.  It was determined the best course of action was to euthanize her humanely.K9 Rudi had served with the Las Vegas Metropolitan Police Department for six months.
K9,Mark,Unknown Breed,Male,6.0,2002-05-19,Sunday,Struck by vehicle,"Osceola County Sheriff's Office, Florida",Florida,,,,"K9 Mark was struck and killed by a patrol car while attempting an apprehension on Jay Drive in St. Cloud, Florida.K9 Mark and his handler had responded to the area to assist deputies search for a subjected wanted for burglary and abduction. The man began to flee on foot from deputies and K9 Mark was released. The subject ran across Jay Drive and with K9 Mark in pursuit. As K9 Mark entered the roadway he was struck by a patrol car that was responding to assist with the foot pursuit.K9 Mark had served with the Osceola County Sheriff's Office for four years."
K9,Woodrow,German Shepherd,Male,5.0,2002-05-24,Friday,Heatstroke,"Philadelphia Police Department, Pennsylvania",Pennsylvania,,,,K9 Woodrow died of heat exhaustion after being accidentally left in his handler's patrol car outside of the canine unit headquarters at the Philadelphia Police Academy.
K9,Sgt. Don Vom Ederbergland,German Shepherd,Male,6.0,2002-01-01,Tuesday,Gunfire,"McLoud Police Department, Oklahoma",Oklahoma,,Rifle,Charged killing a police dog,"K9 Sgt. Don Vom Ederbergland, aka Sgt. Don, was shot and killed by a homeowner after the owner's pitbull attacked him.Sgt. Don and his handler were preparing to leave the handler's home for their shift when the pitbull broke loose from its chain and attacked them. Sgt. Don jumped from the patrol car and started chasing the pitbull back to the other property. His handler called him off and, as he returned to the handler, the pitbulls owner started shooting at Sgt. Don, the handler, and the handler's home with a semi-automatic rifle.Sgt. Don was taken to an emergency animal hospital where he died the following day. The man who shot him was charged with reckless handling of a firearm and killing a police dog.Sgt. Don had served with the McLoud Police Department for two years."
K9,Faro,German Shepherd,Male,4.0,2003-08-22,Friday,Gunfire,"Norfolk Police Department, Virginia",Virginia,2 years,Handgun,,"K9 Faro was shot and killed while attempting an apprehension on a robbery suspect in the 9300 block of 1st View Street.Faro was released after several suspects fled on foot as officers arrived on scene. The subject that Faro caught was able to pull out a handgun and fatally shot him. Officers returned fire, wounding the man.The subject was convicted of several charges and sentenced to 39 years in prison.K9 Faro had served with the Norfolk Police Department for two years."
K9,Ikon,German Shepherd,Male,8.0,2003-03-25,Tuesday,Struck by vehicle,"Everett Police Department, Washington",Washington,,,,"K9 Ikon was struck and killed by a vehicle on I-5, near 112th Street, while tracking a subject during a foot pursuit.The subject had been stopped for a traffic violation and then fled on foot after officers discovered he was wanted on a felony narcotics warrant. Ikon was released from his lead to track the subject through thick underbrush. As Ikon tracked the subject across I-5 he was struck by a vehicle.His handler transported him to a local veterinary clinic where he died shortly after midnight."
K9,Marko,Belgian Malinois,,9.0,2003-08-24,Sunday,Gunfire (Inadvertent),"Los Angeles County Sheriff's Department, California",California,6 years,Officer's weapon,Shot and killed,"K9 Marko was accidentally shot and killed while attempting to control a subject. Sheriff's deputies were confronting the subject who had threatened to kill them.  When Marko's handler released him to control the subject, the subject appeared to raise a weapon at the deputies.  The deputies opened fire, injuring K9 Marko and killing the subject.K9 Marko was airlifted to a veterinary hospital where he succumbed to his wounds."
K9,Alko,German Shepherd,Male,6.0,2003-04-20,Sunday,Stabbed,"Lee County Sheriff's Office, Florida",Florida,3 years,Edged weapon; Knife,Sentenced to 45 years,"K9 Alko died one day after being stabbed by a suspect he was attempting to apprehend in a wooded area near Edison Avenue.Deputies had responded to a prowler call and encountered a subject who began to act irrational. He attacked one of the responding deputies before leading them on a short vehicle pursuit. He abandoned his car and jumped in a canal. K9 Alko was released and attempted to apprehend the man, but the subject punched him and stabbed him before being taken into custody.The man was convicted of nine felony charges and sentenced to 45 years in prison.Alko was taken to a local veterinary hospital where he died the following day."
K9,Bryson,German Shepherd,Male,7.0,2003-01-24,Friday,Automobile crash,"Cattaraugus County Sheriff's Office, New York",New York,,,,"K9 Bryson was killed when the patrol car he was in was struck by a tractor-trailer at the scene of a previous crash on I-86, one-half mile west of Route 219.Two vehicles had crashed after hitting a patch of ice on a bridge over Ismuth Road. As K9 Bryson's handler investigated the crash a tractor-trailer entered the area and collided with the patrol car. K9 Bryson was killed and his handler was injured after being struck during the collision.K9 Bryson served as a narcotics detection canine."
K9,Nero,German Shepherd,Male,5.0,2003-12-27,Saturday,Automobile crash,"Sacramento County Sheriff's Office, California",California,4 years,,,"K9 Nero died as a result of injuries he sustained in an automobile collision on December 23, 2003.  K9 Nero and his handler responded to assist deputies in pursuit of a vehicle stolen from the Sacramento International Airport.  During the pursuit, Nero and his handler were involved in a single vehicle accident.  Nero was ejected from the patrol car and sustained fatal injuries.K9 Nero's career was highlighted by 394 felony arrests and apprehension of 78 criminals."
K9,Urk,German Shepherd,Male,,2003-01-18,Saturday,Gunfire,"San Diego County Sheriff's Department, California",California,3 years,Shotgun,Sentenced to life,"K9 Urk was shot and killed after he and his handler responded to a shots fired call near the intersection of Hacienda Drive and Pomelo Drive, in the Vista area of the county.As they arrived at the scene the subject immediately opened fire with a shotgun, shooting into the patrol car six times. Urk, who was riding in the front seat, was shot and killed. An Explorer was on a ride along with Urk's handler, was shot in the elbow.The subject was arrested the following day and charged with three counts of attempted murder, one count of injuring a police dog, and assault with a deadly weapon. He was sentenced to three life terms.K9 Urk had served with the San Diego County Sheriff's Department for three years. He had assisted in over 1,200 arrests and had apprehended 33 suspects."
