Rank,Name,Breed,Gender,Age,End_Of_Watch,Day_Of_Week,Cause,Department,State,Tour,Weapon,Offender,Summary
K9,Koda,German Shepherd,Male,7.0,2017-12-23,Saturday,Duty related illness,"Brockton Police Department, Massachusetts",Massachusetts,,,,"K9 Koda died four days after suffering a medical emergency while actively tracking a suspect.Koda's handler noticed a behavior change during the track and immediately transported him to a local veterinary hospital. He underwent emergency surgery but suffered a cardiac event and passed away on December 23rd, 2017.K9 Koda had served with the Brockton Police Department for five years."
K9,Chris,Dutch Shepherd,Male,8.0,2017-07-12,Wednesday,Gunfire,"Yancey County Sheriff's Office, North Carolina",North Carolina,7 years,Gun; Unknown type,,K9 Chris was shot and killed inside the kennel at his handler's home in the Bald Mountain area of Yancey County.K9 Chris had been placed in his kennel at approximately 8:30 pm and its body was discovered at approximately 5:00 am. Investigators believe that Chris was known to be a sheriff's canine when shot.K9 Chris had served with the Yancey County Sheriff's Office for seven years.
K9,Endy,Belgian Malinois,Male,8.0,2017-07-03,Monday,Heatstroke,"Cache County Sheriff's Office, Utah",Utah,7 years,,,K9 Endy died after suffering heat exhaustion when he was unintentionally left in his handler's patrol truck following their shift.Endy had served with the Cache County Sheriff's Office for one year and had previously served with the Logan Police Department for six years. He served as a narcotics detection canine and patrol canine.
K9,Diesel,German Shepherd,Male,,2017-04-28,Friday,Heatstroke,"Sebastian Police Department, Florida",Florida,,,,"K9 Diesel died after being accidentally left in his handler's patrol car at the Brevard County Courthouse in Melbourne, Florida.Diesel was discovered in the back of the SUV at approximately 7:30 pm."
K9,Freckles,Beagle,Female,11.0,2017-05-10,Wednesday,Heatstroke,"Florida Department of Corrections, Florida",Florida,,,,K9 Freckles died after suffering heat exhaustion while tracking a wanted fugitive as part of a multi-day manhunt in the Laurel Hill area of Okaloosa County.The suspect had lead officers from the Florida Fish and Wildlife Commission on a pursuit before abandoning the stolen truck he was driving and fleeing on foot. A handgun was found in the truck following the pursuit. It is believed the man then committed several burglaries and vehicle larcenies in the area over several days.Freckles had served with the Florida Department of Corrections for 11 years at the Okaloosa Correctional Institution.
K9,Rico,Dutch Shepherd,Male,3.0,2017-03-26,Sunday,Gunfire,"Alaska State Troopers, Alaska",Alaska,6 months,Handgun,Shot and killed,"K9 Rico was shot and killed while attempting an apprehension of a suspect following a pursuit in Wasilla.The driver of the vehicle led troopers on a 45-minute pursuit after they attempted to stop him for traffic violations. The subject had several outstanding warrants.Troopers were able to disable the vehicle with spike strips near mile 45 on Parks Highway. K9 Rico was deployed when the man fled and refused to follow commands. The subject opened fire on Rico, killing him, before being shot and killed by the troopers.K9 Rico had served with the Alaska State Troopers for only six months."
K9,Kane,Belgian Malinois,Male,,2017-12-03,Sunday,Struck by vehicle,"Bell County Sheriff's Department, Kentucky",Kentucky,,,,"K9 Kane was struck and killed by a vehicle as during a traffic stop on U.S. 25E at the Bell-Knox County line.K9 Kane's handler had responded to assist a Kentucky State Police trooper and deployed Kane to perform a narcotics sniff. Kane gave a positive indication of narcotics in the vehicle, resulting in the seizure of narcotics and paraphernalia. When Kane's handler gave him his reward, the ball bounced off of him and into traffic. Kane ran after the ball and was struck by a vehicle."
K9,Rooster,Belgian Malinois,Male,,2017-03-18,Saturday,Gunfire,"Wichita Police Department, Kansas",Kansas,5 years,Gun; Unknown type,Shot and killed,K9 Rooster was shot and killed while attempting an apprehension of a subject the scene of a domestic disturbance.Officers had been sent to the mobile home in the 2300 block of East MacArthur Road to investigate the incident. A male subject exited the home with a firearm and the went back inside. The subject opened fire on K9 Rooster when he was released to attempt an apprehension.Other officers on scene returned fire and killed the subject.K9 Rooster had served with the Wichita Police Department for five years.
K9,Kyro,Belgian Malinois,Male,4.0,2017-04-25,Tuesday,Gunfire (Inadvertent),"Houston County Sheriff's Office, Georgia",Georgia,3 years,Officer's handgun,,"K9 Kyro was shot after he mistook his handler for a suspect while performing a track in a heavily wooded area while assisting the Dooly County Sheriff's Office.Kyro bit his handler's calf and failed to release, causing severe damage to his handler's leg. His handler was forced to shoot Kyro in order to prevent further injury.K9 Kyro had served with the Houston County Sheriff's Office for three years."
K9,Billy,Belgian Malinois,Male,,2017-12-04,Monday,Automobile crash,"Hillsboro Police Department, Oregon",Oregon,,,,"K9 Billy was killed in a vehicle crash at the intersection of SE Tualatin Valley Highway and Century Boulevard at approximately 10:40 pm.Another vehicle attempted to make a left turn in front of the handler's patrol car, causing a collision. K9 Billy's handler suffered minor injuries, but K9 Billy suffered severe trauma."
K9,Jax,German Shepherd,Male,4.0,2017-10-31,Tuesday,Stabbed,"Sunnyvale Department of Public Safety, California",California,2 years,Edged weapon; Knife,Shot and killed,K9 Jax was stabbed to death while attempting an apprehension at an apartment complex in the 500 block of East Weddell Avenue.Officers had responded to a domestic violence incident in which a subject had stabbed his girlfriend. The man then barricaded himself inside of his home and refused commands to surrender. K9 Jax was stabbed when he was deployed to apprehend the subject.The man was then shot and killed by an officer on scene when he attempted to attack the officers with the knife.K9 Jax was transported to an emergency veterinary hospital where he died.K9 Jax had served with the Sunnyvale Department of Public Safety for two years.
K9,Ori,German Shepherd,Male,1.0,2017-11-10,Friday,Struck by vehicle,"Antrim County Sheriff's Office, Michigan",Michigan,,,,K9 Ori was struck and killed by a vehicle while working on off-leash obedience training in Kalkaska County.K9 Ori had only served with the Antrim County Sheriff's Office for two weeks.
K9,Mojo,Labrador Retriever,Male,,2017-07-06,Thursday,Heatstroke,"DeKalb County Sheriff's Office, Indiana",Indiana,,,,K9 Mojo died after unintentionally being left in his handler's patrol car following their shift.His handler had returned home and became distracted due to an incident involving his newborn child. K9 Mojo was located in the back of the patrol car approximately four hours later.
K9,Argo,German Shepherd,Male,3.0,2017-11-07,Tuesday,Fall,"Normandy Police Department, Missouri",Missouri,,,,K9 Argo succumbed to injuries sustained two days earlier when he fell from the fourth level of a parking garage.His handler had taken him to the garage to seek refuge during a hail storm. Argo became disoriented during the storm and inadvertently jumped over the garage's exterior wall. He was taken to a local veterinary hospital where he died two days later.
K9,Aron,German Shepherd,Male,6.0,2017-07-02,Sunday,Heatstroke,"Lauderdale County Sheriff's Office, Mississippi",Mississippi,5 years,,,"K9 Aron died after suffering heat exhaustion when his handler's patrol car suffered a mechanical malfunction, causing the vehicle and it's hot box backup system to shut off.K9 Aron had served with the Lauderdale County Sheriff's Department for five years."
K9,Mojo,Belgian Malinois,Male,,2018-02-15,Thursday,Vehicular assault,"North Charleston Police Department, South Carolina",South Carolina,5 years,Automobile; Alcohol involved,Charged with felony DUI,"K9 Mojo was killed in a vehicle crash when his handler's patrol car collided with another vehicle on Rivers Avenue and Gumwood Boulevard at approximately 9:00 pm.Mojo's handler was responding to another call, with all emergency equipment activated, when another vehicle attempted to turn left in front of him, causing a collision. Mojo was transported to an emergency veterinary hospital where he passed away. His handler and the other driver both suffered minor injuries.The driver who caused the crash was charged with felony DUI.K9 Mojo had served with the North Charleston Police Department for five years."
K9,Choper,German Shepherd,Male,5.0,2018-06-06,Wednesday,Fall,"Conewango Township Police Department, Pennsylvania",Pennsylvania,3 years,,,"K9 Choper died from injuries suffered when he fell from the roof of a three-story building at the corner of Pennsylvania Avenue And Elm Street in Warren, Pennsylvania.He and his handler were conducting a training exercise in the abandoned building with the accident occurred at approximately 9:35 pm. K9 Choper was rushed to a veterinary hospital where he died shortly after midnight.K9 Choper had served with the Conewango Township Police Department for three years."
K9,Kastor,Belgian Malinois,Male,2.0,2018-10-05,Friday,Gunfire (Inadvertent),"Waco Police Department, Texas",Texas,"1 year, 4 months",Officer's handgun,,K9 Kastor was shot and killed after inadvertently biting his handler on the inner thigh during a warrant service in the 2000 block of Seneca Avenue.Kastor would not release his bite despite his handler's commands and another officer attempting to pull the dog off of him. After all efforts to have Kastor release his bite he was shot in order to prevent additional injury to the handler.Kaster had served with the Waco Police Department for 16 months.
K9,Bane,Belgian Malinois-German Shepherd mix,Male,1.0,2018-12-09,Sunday,Gunfire,"Tulare Police Department, California",California,2 weeks,Gun; Unknown type,Shot and killed,"K9 Bane was shot and killed near the intersection of Tulare Avenue and Palm Street while attempting to apprehend a suspect following a vehicle pursuit.The pursuit began after another officer attempted to conduct a traffic stop. The pursuit left the city and continued until the vehicle came to a stop. K9 Bane was released for an apprehension as at least one of the occupants of the vehicle opened fire, striking K9 Bane and wounding handler. Other officers on the scene returned fire, killing one suspect and wounding a second. The third subject was taken into custody and charged with four counts of attempted homicide of a police officer, the death of a police dog, and four outstanding misdemeanor warrants.K9 Bane had completed training only 2 weeks earlier and was working his first full weekend on duty."
K9,Rocky,German Shepherd,Male,3.0,2018-10-02,Tuesday,Training accident,"Genesee County Sheriff's Office, Michigan",Michigan,,,,"K9 Rocky died when his airway became blocked during a training exercise in the area of Morrish Road and Fortino Drive in Swartz Creek, Michigan.His handler rushed him to a local veterinary hospital but they were unable to revive him.K9 Rocky had served with the Genessee County Sheriff's Office for one year."
K9,Rocky,German Shepherd,Male,,2018-09-02,Sunday,Automobile crash,"Riverhead Police Department, New York",New York,7 years,Automobile,,K9 Rocky was killed in a vehicle crash near the intersection of West Main Street and Raynor Avenue as his handler responded to a vehicle pursuit at approximately 2:30 a.m.An officer working a DWI checkpoint was struck by a vehicle whose driver refused commands to stop and fled. Rocky's handler was responding to the resulting vehicle pursuit when his patrol car left the roadway and struck a utility pole. Rocky sustained fatal injuries when he was ejected from the patrol car.The pursuit was terminated due to the suspect's dangerous driving behavior. The driver remains at large.K9 Rocky had served with the Riverhead Police Department for seven years.
K9,Bandit,Belgian Malinois,Male,4.0,2018-11-15,Thursday,Gunfire (Inadvertent),"Sutter County Sheriff's Office, California",California,"1 year, 4 months",Handgun,Shot and killed,"K9 Bandit was shot and killed while attempting an apprehension of a double murder suspect in Butte County.Officers had been alerted to a suspicious vehicle in the Camp Fire evacuation zone and learned that the vehicle was connected to a parolee wanted for a double murder. When responding officers tapped on the window to wake the man up he made furtive movements towards a weapon in his jacket, causing the officers to seek cover. The man then led officers on a vehicle pursuit until his vehicle immobilized by stop sticks in the area of Highway 70 and Pentz Road.K9 Bandit was released for an apprehension after the man exited his vehicle and aggressively approached officers while raising a firearm. As Bandit made the apprehension officers on scene opened fire, fatally wounding the man and striking K9 Bandit in the crossfire. A pit bull in the man's vehicle then began to attack K9 Bandit before being shot by officers."
K9,Boco,Belgian Malinois,Male,,2018-08-17,Friday,Gunfire,"Lincoln Parish Sheriff's Office, Louisiana",Louisiana,,Gun; Unknown type,In custody,"K9 Boco was shot and killed in the area of Chandler Road while attempting to apprehend a suspect who was wanted for attempted murder.The suspect had shot his girlfriend in the head earlier in the morning in Monroe, Louisiana. Investigators had learned that the man was at a residence on Chandler Road in Lincoln Parish. As deputies arrived at the scene at approximately 7:30 pm the man fled into a wooded area behind the home. K9 Boco was released for an apprehension as the man fled. Deputies heard several gunshots moments later.The man was taken into custody at approximately 2:00 am. K9 Boco's body was recovered at approximately 3:45 am."
K9,Benzi,Belgian Malinois,Male,3.0,2018-09-01,Saturday,Gunfire (Inadvertent),"Columbus Division of Police, Ohio",Ohio,2 years,Officer's handgun,,"K9 Benzi was shot after attacking his handler at the agency's canine facility at 2609 McKinley Avenue.Benzi's handler was correcting his behavior with verbal commands when the dog attacked him, causing serious wounds to his handler's arm. Benzi continued to disobey his handler's command to release, giving his handler no other option except to shoot him. A tourniquet was applied to the handler's arm and he was transported to a local hospital.Benzi was taken to a local veterinary hospital where he was humanely euthanized due to the wound.K9 Benzi had served with the Columbus Division of Police for two years."
K9,Cade,Belgian Malinois,Male,5.0,2018-07-04,Wednesday,Duty related illness,"Hendricks County Sheriff's Office, Indiana",Indiana,"3 years, 6 months",,,"K9 Cade died after suffering a medical emergency while tracking a suspect in the area of Ronald Reagan Parkway and County Road 300 North in Brownsburg, Indiana.Other units had attempted to stop a vehicle, which fled and led them on a pursuit. The subject drove to a woodline and then fled on foot into the woods. Officers set up a perimeter and K9 Cade was deployed to track and apprehend the subject.K9 Cade began showing symptoms of distress and was immediately transported to a local veterinarian. He succumbed the following day.K9 Cade had served with Hendricks County Sheriff's Office for 3-1/2 years."
K9,Max,Belgian Malinois,Male,9.0,2018-07-11,Wednesday,Heatstroke,"Durham County Sheriff's Office, North Carolina",North Carolina,,,,K9 Max died of heat exhaustion after the failsafe device to activate in his handler's patrol car after the air conditioner failed.He remained in the patrol car as his handler attended a training exercise.K9 Max had served with the Durham County Sheriff's Office for seven years.
K9,Smokey,Labrador Retriever,Male,3.0,2018-08-28,Tuesday,Struck by vehicle,"Nowata Police Department, Oklahoma",Oklahoma,1 year,,Arrested,"K9 Smokey was struck and killed by a tractor-trailer after an intoxicated woman let him out of his handler's patrol car on U.S. 169, just north of the Nowata Municipal Airport service road.Smokey's handler encountered an intoxicated woman walking in the roadway. The woman approached his patrol car as he stopped to talk to her and opened the back door, allowing Smokey to jump out onto the roadway. Smokey was struck by the oncoming truck as his handler called him to return to the vehicle.The woman was arrested and charged in connection with the incident.K9 Smokey had served with the Nowata Police Department for one year."
K9,Bane,Belgian Malinois,Male,3.0,2018-04-17,Tuesday,Unidentified,"Phoenix Police Department, Arizona",Arizona,2 years,Person,Sentenced to 25 years,K9 Bane was killed while attempting an apprehension following a vehicle pursuit of a stolen vehicle.A male and female had led officers on a 30-minute pursuit after carjacking a vehicle. The pursuit ended after the vehicle struck stop sticks in the area of 27th Avenue and Bethany Home Road. Both subjects fled the scene. The female was immediately apprehended while the male subject fled on foot. A SWAT team located the subject hiding in the attic of a nearby home and K9 Bane was released for an apprehension but was killed during the apprehension. The cause of death was determined to be asphyxiation.The suspect was sentenced to 25 years in February 2020.K9 Bane had served with the Phoenix Police Department for two years.
K9,Grunt,Bluetick Coonhound mix,Female,8.0,2018-09-01,Saturday,Assault,"Refugio County Sheriff's Office, Texas",Texas,,Person,Arrested,"K9 Grunt and K9 Nell were strangled to death by a suspect they were tracking while assisting the Aransas County Sheriff's Office and other state and federal agencies.Officers in Aransas County had been involved in a pursuit in which 16 illegal aliens bailed out of a vehicle and fled into the brush along Route 35 north of Holiday Beach, Texas. Members of the Aransas County Sheriff's Office, Texas Department of Public Safety, Texas Parks and Wildlife Department, and United States Border Patrol were searching for the suspects and requested assistance from Refugio County's tracking team.Nell and Grunt, who were trained to track critically missing persons with dementia, were let off leash as deputies followed them on horseback. The non-aggressive dogs tracked one subject into some brush but did not come out. As deputies called for the man to surrender he taunted them in Spanish. Deputies entered the brush and took him into custody. The bodies of Nell and Grunt were found with their tracking collars twisted tightly around their necks.Both dogs were a mix of black and tan coonhound, bluetick coonhound, and redtick coonhound."
K9,Hemi,Dutch Shepherd,Male,6.0,2018-07-30,Monday,Gunfire,"Arkansas State Police, Arkansas",Arkansas,5 years,Gun; Unknown type,Shot and killed,"K9 Hemi was shot and killed while attempting an apprehension of a subject involved in an earlier vehicle pursuit in Missouri.The vehicle fled into Arkansas and was located by troopers near mile marker 56 on I-55 in Mississippi County. The vehicle came to a stop and the driver immediately fled onto nearby farm property. K9 Hemi was deployed for an apprehension and caught the subject, but the man produced a gun and shot him. The man was then shot and killed by officers after shooting at them.K9 Hemi had served with the Arkansas State Police for five years."
K9,Cigo,Unknown Breed,Male,3.0,2018-12-24,Monday,Gunfire,"Palm Beach County Sheriff's Office, Florida",Florida,,Handgun; .45 caliber,Shot and wounded,"K9 Cigo was shot and killed while attempting an apprehension of an attempted-murder suspect at the Wellington Green Mall at 10300 Forest Hill Avenue.Investigators received information that two Latin King gang members who were wanted for attempted murder were meeting someone at the mall. The agency's tactical team deployed to the area and waited for the two suspects to exit the mall into the parking lot.As the team attempted to an apprehension one of the suspect's opened fire with a .45 caliber handgun, killing K9 Cigo. Deputies returned fire and wounded the suspect. The second suspect was taken into custody without incident."
K9,Eico,Belgian Malinois,Male,2.0,2018-03-11,Sunday,Struck by vehicle,"Davis County Sheriff's Department, Iowa",Iowa,2 years,,,K9 Eico was struck and killed by a vehicle in the 2100 block of Lilac Avenue.Eico's handler had stopped to fuel up his patrol car and to allow him to exercise. Eico inadvertently ran onto Lilac Avenue and was struck by a vehicle.K9 Eico had served with the Davis County Sheriff's Department for two years.
K9,Rush,German Shepherd,Male,4.0,2018-10-01,Monday,Duty related illness,"Boston Police Department, Massachusetts",Massachusetts,"3 years, 6 months",,,"K9 Rush died as the result of exposure to chemicals that occurred on September 23rd, 2018.K9 Rush and his handler were clearing a building after responding to reports of a burglary in progress at the old Radius Specialty Hospital at 45 Townsend Street in Roxbury. During the search, K9 Rush ingested or inhaled toxic chemicals that were present in the building. The chemicals caused him to go into respiratory distress.He was taken to a veterinary hospital where he remained for eight days until it was determined he could not recover, and he was humanely euthanized.K9 Rush had served with the Boston Police Department as a patrol and narcotics detection canine for three years."
K9,Tuco,German Shepherd,Male,,2018-05-20,Sunday,Drowned,"Stephens County Sheriff's Office, Oklahoma",Oklahoma,,,,"K9 Tuco drowned after his handler's patrol car crashed into a flooded ravine on Highway 29 while responding to a water rescue at approximately 4:00 am.The patrol car hydroplaned and rolled over into the water. Another deputy following behind the patrol car was able to rescue Tuco's handler from the vehicle, which was submerged under water. The two deputies both tried to rescue Tuco but were unable to remove him from the vehicle."
K9,Axe,German Shepherd,Male,4.0,2018-11-04,Sunday,Gunfire,"St. Clair Shores Police Department, Michigan",Michigan,2 years,Handgun,Shot and killed,"K9 Axe was shot and killed after officers responded to reports of an armed subject outside of a banquet hall at 26211 Harper Avenue.As officers arrived on the scene they encountered a subject who was armed with a rifle and handgun. The man fled on foot with officers in pursuit. K9 Axe was deployed for an apprehension and was shot by the man.Officers returned fire, killing the subject.K9 Axe had served with the St. Clair Shores Police Department for two years.K9 Axe was named in memory of U.S. Navy SEAL Petty Officer 2nd Class Matthew Axelson who was killed in combat in Afghanistan in 2005."
K9,Turbo,Labrador Retriever,Male,2.0,2018-07-28,Saturday,Heatstroke,"Columbia Police Department, South Carolina",South Carolina,7 months,,,"K9 Turbo died as the result of heat exhaustion while in his handler's department vehicle at C.A. Johnson High School.Turbo had been left in the vehicle, which had its air conditioner on and its windows rolled down, while his handler was participating in active shooter training inside of the high school. When his handler returned at the end of the training Turbo was showing signs of heat exhaustion. He was taken to an animal hospital where he was treated for two days before veterinarians determined it was most humane to euthanize him.Turbo had served as an explosives detection canine with the Columbia Police Department for seven months."
K9,Midas,Belgian Malinois-German Shepherd mix,Male,4.0,2018-07-30,Monday,Heatstroke,"Hancock County Sheriff's Office, West Virginia",West Virginia,3 years,,,"K9 Midas died from complication of heat exhaustion suffered after the air conditioning unit and the failsafe unit failed in his handler's patrol car.The vehicle was parked at the Hancock County Sheriff's Office when the failure occurred. The patrol car was equipped with a failsafe system that was intended to roll down the windows and activate an alarm if the air conditioner stopped, but the failsafe system did not activate.K9 Midas was transported to a local veterinary office where he suffered additional complications from the heat exhaustion and died later that day.K9 Midas had served with the Hancock County Sheriff's Office for three years."
K9,Rony,Belgian Malinois,Male,,2018-02-21,Wednesday,Accidental,"Houston Police Department, Texas",Texas,7 years,Person,,"K9 Rony died after suffering a serious injury following a vehicle and foot pursuit of a subject who had been driving a stolen car at approximately 1:00 am.The driver led officers on a vehicle pursuit, during which time he threw contraband from the window and intentionally rammed a patrol car. The driver bailed out of the vehicle in the 12700 block of River Trail and fled on foot. K9 Rony was released for an apprehension in a heavily wooded area. One of Rony's legs became entangled in a wooden object and suffered a serious injury. He was rushed to a veterinary hospital where it was determined the most humane treatment would be to euthanize him.The subject was taken into custody by other officers.K9 Rony had served with the Houston Police Department for seven years and was credited with 250 apprehensions."
