Rank,Name,Breed,Gender,Age,End_Of_Watch,Day_Of_Week,Cause,Department,State,Tour,Weapon,Offender,Summary
K9,Vag,Mixed,Male,,1877-04-12,Thursday,Struck by streetcar,"Buffalo Police Department, New York",New York,5 years,,,"K9 Vag, aka Sergeant Vag, was struck and killed by a streetcar on Niagara Street, near Hudson Street, after being attacked by a stray dog.Vag had left the First Precinct with a police officer who had just left to go home and boarded the streetcar. Vag was following the streetcar when he was attacked.K9 Vag had been a vagrant dog who was adopted by the officers at the First Precinct five years earlier. He regularly accompanied officers as they walked their beats and was credited with several criminal apprehensions as well as assisting with the rescue of a drowning person."
K9,Danger,Russian Terrier,Male,,1896-06-09,Tuesday,Struck by train,"New York, Chicago and St. Louis Railroad Police Department, Railroad Police",United States,3 years,,,"K9 Danger was struck and killed by a train on the Lake Shore and Michigan Railway tracks near West 17th Street in Chicago, Illinois.Danger and his handler were patrolling the railroad yard when Danger suddenly started chasing a cat. The cat and Danger both ran in front of an oncoming train and were killed.K9 Danger had been rescued by his handler three years earlier after several boys tied a can to his tail. His handler, a special officer for the railroad, trained him to search for trespassers on the railroad property and the two patrolled the yards together for three years."
K9,Ollie,Unknown Breed,Male,,1909-08-26,Thursday,Struck by vehicle,"New York City Police Department, New York",New York,,Automobile,,"K9 Ollie was struck and killed by a hit-and-run driver near the intersection of Ocean Boulevard and 18th Avenue, in Brooklyn.Ollie and his handler were walking their beat when the vehicle struck him and then fled.Ollie was one of 15 police dogs assigned to the Parkville Station."
K9,Trooper,German Shepherd,Male,,1961-03-17,Friday,Assault,"Kansas City Police Department, Missouri",Missouri,,Blunt object,Shot and killed,"K9 Trooper died from injuries sustained when he was repeatedly struck on the back with a crowbar while protecting his handler.Trooper's handler had responded to a burglary call near the intersection of 27th Street and Indiana Avenue. While on scene the handler was attacked by two men and was being assaulted with a crowbar. Trooper lunged at one subject but was unable to make a steady hold due to thick clothing. Undeterred, Trooper continued to attack the man until grabbing hold of his face and pulling him backward.The takedown allowed his handler to draw his weapon and fatally shoot the man. The second subject struck K9 Trooper with the crowbar repeatedly, causing serious injuries and partial paralysis.K9 Trooper died from his injuries one week later."
K9,Caesar,German Shepherd,Male,,1961-04-10,Monday,Struck by vehicle,"Lancaster Police Department, Pennsylvania",Pennsylvania,10 months,,,"K9 Caesar was struck and killed by a vehicle while chasing a stray dog at Long's Park on Harrisburg Pike.K9 Caesar and his partner had gone to the park for exercise when he darted from his partner when he opened the back door of the police vehicle. As K9 Caesar returned to his partner after being called, he was struck by a vehicle and killed.K9 Caesar served with the Lancaster Police Department for ten months. He was buried with police honors at the K9 Training grounds where K9 Caesar trained with his handler on New Danville Pike."
K9,Baron,Australian Cattle Dog,Male,,1962-09-12,Wednesday,Assault,"Virginia State Police, Virginia",Virginia,,,,K9 Baron was assaulted and beaten to death by an escaped inmate he had been tracking in Powhatan County.Approximately 50 officers were searching for two convicts who had escaped from the Goochland State Prison Farm and stole a row boat to cross the James River. K9 Baron located one of the men and was killed after being attacked by the man.
K9,Lobo,German Shepherd,Male,5.0,1963-05-30,Thursday,Duty related illness,"Pittsburgh Bureau of Police, Pennsylvania",Pennsylvania,2 years,Poison,Unsolved,"K9 Lobo died moments after ingesting a hot dog laced with poison while on duty near the intersection of Lincoln Avenue and Lemington Avenue.K9 Lobo and his partner were on patrol in the City's Lincoln–Lemington–Belmar neighborhood when he discovered a bundle wrapped with pink tissue paper on the sidewalk. As K9 Lobo investigated the bundle he discovered a hot dog and ingested it. K9 Lobo's legs became stiff, and he died less than five minutes after eating the hot dog.During the investigation, it was determined that the hot dog had been hallowed-out in the middle and filled with poison. There had been over 30 deaths of dogs in the area with the same method in a year. It is unknown if any arrests were ever made.K9 Lobo served with the Pittsburgh Bureau of Police for two years."
K9,Sultan,German Shepherd,Male,2.0,1963-09-06,Friday,Fall,"San Francisco Police Department, California",California,10 months,,,"K9 Sultan was killed when he fell over a wall while searching for a missing person near the Golden Gate Bridge.The missing person's vehicle had been found in a parking lot near the bridge. K9 Sultan and his partner had been dispatched to the area to help locate the missing person. While K9 Sultan and his partner were searching on a walkway directly below the bridge, his partner leaned over a railing to look below them when K9 Sultan fearing for his partner's safety darted towards him and fell 60 feet below onto rocks at the bottom, killing him.K9 Sultan was one of the first K9s attached to the departments K9 Corps and served with the San Francisco Police Department for ten months."
K9,Donka,German Shepherd,Male,,1965-07-08,Thursday,Gunfire,"Stockton Police Department, California",California,"3 years, 6 months",Shotgun,,"K9 Donka was shot and killed by a sheriff's deputy while attempting to apprehend two California Youth Authority escapees near the intersection of Weber Avenue and Highway 99Officer and sheriff's deputies had pursued the two in a stolen vehicle until it crashed into a ditch. K9 Donka was released for an apprehension when both subjects fled on foot from the wrecked car. As K9 Donka ran toward the subject he collided with a fence and became disoriented. He turned and began to run toward a San Joaquin County Sheriff's Office deputy, who shot him with a shotgun to protect himself from being bit.Both subjects were taken into custody.K9 Donka had served with the Stockton Police Department for 3-1/2 years."
K9,Sam,German Shepherd,Male,,1965-02-27,Saturday,Gunfire (Inadvertent),"Chicago Police Department, Illinois",Illinois,,Officer's handgun,,"K9 Sam was shot and killed by an officer after K9 Sam bit another officer while searching the Reavis School at 834 East 50th Street. After other officers found the doors open, they began searching the building. K9 Sam was released into the building to conduct a search. Mistaking one of the officers as an intruder, K9 Sam attempted to apprehend him and bit the officer. Another officer shot K9 Sam in an attempt to save his partner. K9 Sam was assigned to the Chicago Police Department – Bureau of Operational Services, Patrol Division, Special Operations Group: Unit 058 – Canine Unit. "
K9,Apache,Unknown Breed,Male,,1966-03-29,Tuesday,Automobile crash,"Chattanooga Police Department, Tennessee",Tennessee,,,,K9 Apache died as the result of injuries sustained in an automobile accident as his handler responded to a burglary in progress call. The patrol car crashed after the officer attempted to avoid a hazard in the roadway.Apache's suffered injuries so severe that he had to be euthanized.
K9,Hans,German Shepherd,Male,,1966-10-22,Saturday,Struck by vehicle,"Michigan State Police, Michigan",Michigan,3 years,,,K9 Hans was struck and killed by a car in Oakland County after his handler let him out of their cruiser for a break.K9 Hans had served with the Michigan State Police for three years.
K9,Heiko,German Shepherd,Male,,1968-06-03,Monday,Fall,"San Francisco Police Department, California",California,"1 year, 6 months",,,"K9 Heiko was killed while tracking burglary suspects when he fell from a building.K9 Heiko and his partner responded to 999 Van Ness Avenue for a burglar alarm at 12:10 am. Once on scene officers discovered a vehicle containing car and engine parts. The burglars, frightened by the police escaped to the roof of the building. K9 Heiko followed the thieves to the top of a fire escape, jumped a 3 1/2 foot parapet, and fell 48 feet from the roof to the street below.K9 Heiko served with the San Francisco Police Department for 18 months."
K9,Rex,German Shepherd,Male,3.0,1968-09-22,Sunday,Gunfire,"Huntsville Police Department, Alabama",Alabama,1 year,Handgun; .41 caliber,Apprehended,"K9 Rex was shot and killed while attempting an apprehension at the Whiteway Mobile Home Ranch near the intersection of Grace Street and Angelo Street (modern-day area of Memorial Parkway and Sparkman Drive).Officers were dispatched to the area to investigate the reports of gunfire at about 11:00 pm. Upon arrival, they located at least two mobile homes that had been struck by bullets. An officer went to the mobile home of the man he believed to be a suspect and looked through the window. He saw the man pacing the floor with a holstered pistol on his belt. The officer called for more assistance including a canine unit.By the time other units arrived, the suspect was outside his mobile home walking back and forth yelling at responding Officers. He drew his weapon several times and challenged the police to take it from him. K9 Rex was released by his handler for an apprehension. As K9 Rex attacked the suspect the man stepped aside. K9 Rex attacked a second time at which time the suspect shot him.While K9 Rex continued engaging the suspect, other officers were able to move into position and take the man into custody. The man was given probation and ordered to reimburse the department $200.K9 Rex had served with the Huntsville Police Department for one year."
K9,Thor,German Shepherd,Male,4.0,1969-04-25,Friday,Gunfire,"Miami Beach Police Department, Florida",Florida,,Handgun,Shot and killed,"K9 Thor was shot killed as his handler responded to a prowler call at 65030 Allison Road at 2:45 am.The homeowner had called the police to report a man attempting to get into his house. When Thor's handler arrived at the scene he noticed a flashlight being used in the home's backyard. He and Thor walked around to the back of the home where Thor suddenly alerted and began to growl.Thor's handler pointed his flashlight in the direction Thor was pointing and saw a man crouched down in the bushes. The man opened fire on Thor and his handler. Thor was fatally wounded by one of the shots fired by the suspect, who was also killed during the incident."
K9,Kirk,German Shepherd,Male,9.0,1970-12-03,Thursday,Gunfire,"Chicago Police Department, Illinois",Illinois,,Handgun,Shot and killed,K9 Kirk was shot and killed by a robbery suspect he was apprehending in an empty lot at 7502 S. Dorchester Avenue.The suspect shot K9 Kirk in the neck as Kirk attempted the apprehension. Officers on the scene returned fire and killed the subject.
K9,Fury,German Shepherd,Male,3.0,1971-04-12,Monday,Gunfire,"York City Police Department, Pennsylvania",Pennsylvania,,Handgun; .22 caliber,,"K9 Fury was shot and killed while attempting an apprehension of a homicide suspect behind a restaurant at Carlisle Road and Brougher Lane near Shiloh.The subject, who had murdered a woman during a burglary earlier in the day, had been located by officers who chased him behind the restaurant. K9 Fury was released for an apprehension but was shot by the man with a .22 caliber handgun. The man later committed suicide."
K9,Duke,Unknown Breed,Male,,1972-04-23,Sunday,Fall,"Baltimore City Police Department, Maryland",Maryland,,,,K9 Duke was killed when he fell from the top of a six-floor building while he and his partner searched it in response to a burglary call.They were on the roof of the Hochschild Kohn store when Duke jumped over a parapet while chasing a suspect who escaped down a fire escape. K9 Duke fell to the ground and died.
K9,King,Unknown Breed,,,1972-06-03,Saturday,Gunfire,"Augusta County Sheriff's Office, Virginia",Virginia,,,,"K9 King was shot and killed by a suspect during an open area search As he was attempting to locate a suspect, King was shot once.  Despite being wounded, he still attempted to apprehend the suspect but was shot and killed."
K9,Caesar,German Shepherd,Male,4.0,1972-02-14,Monday,Fall,"Chicago Police Department, Illinois",Illinois,,,,"K9 Caesar died after falling from a balcony in the Presentation Catholic Church at 758 South Springfield Avenue while searching for a suspect wanted for shooting a police officer.The officer had been shot by several juveniles at a nearby community center. K9 Caesar and another canine were put in the church during the search of the suspects. During the search K9 Caesar rushed up the stairs to the choir loft and, while jumping from row to row, inadvertently jumped over the railing and fell 40 feet to the pews below."
K9,Quint,Unknown Breed,Male,4.0,1974-02-06,Wednesday,Struck by vehicle,"Manteca Police Department, California",California,,,,K9 Quint was struck and killed by a vehicle on Highway 99 while tracking a prowler.A resident had called police to report a prowler at 304 Lovell Way. K9 Quint began tracking the suspect and ran into the path of a vehicle on the adjacent highway.
K9,Harvey,German Shepherd,Male,3.0,1974-03-23,Saturday,Unidentified,"Detroit Public Schools Community District Police Department, Michigan",Michigan,,,,K9 Harvey disappeared from his handler's patrol car while it was parked behind the Detroit Police Department's 13th Precinct at the intersection of Woodward Avenue and Hancock Street.Harvey and his handler had apprehended a burglary suspect at the Longfellow School and had gone to the precinct for the handler to book the subject. When his handler returned to the patrol car Harvey was missing. He was never recovered and was presumed dead.K9 Harvey had served with the Detroit Board of Education Police for two years.
K9,Woo,German Shepherd,,,1974-11-23,Saturday,Struck by vehicle,"Tucson Police Department, Arizona",Arizona,,,,K9 Woo was struck and killed by a parol car at the scene of a burglary call.
K9,Art,German Shepherd,Male,3.0,1974-08-26,Monday,Gunfire (Inadvertent),"Houston Police Department, Texas",Texas,,Officer's handgun,,"K9 Art was accidentally shot and killed by his handler during a shootout with two juveniles.His handler had pulled a vehicle over with two juveniles inside. One of the two youths exited the vehicle with a shotgun and fired as K9 Art was released. K9 Art's partner returned fire accidentally striking K9 Art.In November 1974, the subjects' attorney had a necropsy done on K9 Art and a .45 caliber bullet was removed. The juvenile was then charged with attempted murder."
K9,Silver,German Shepherd,Male,,1975-06-27,Friday,Gunfire,"Chandler Police Department, Arizona",Arizona,,Shotgun; 20 gauge,Unknown,"K9 Silver was shot and killed while training at the Jaycees Clubhouse at Frye and McQueen Roads in Chandler. Silver was in the yard of the Clubhouse, chasing a lizard near the chain-link fence when a neighbor shot K9 Silver with a shotgun. "
K9,Condor,German Shepherd,Male,,1975-10-30,Thursday,Struck by vehicle,"Cincinnati Police Department, Ohio",Ohio,4 years,,,K9 Condor was struck and killed by a vehicle when he began chasing a stray dog outside of the new 4th District police facility at 4150 Reading Road.Condor's handler had been assigned to inspect the new facility before its grand opening. His handler had just let him out of their cruiser when he saw the dog and started chasing it. K9 Condor and the stray dog were both struck and killed by an oncoming car after running into the roadway.K9 Condor had served with the Cincinnati Police Department for four years.
K9,Fritz,German Shepherd,Male,,1975-04-28,Monday,Fall,"Pittsburgh Bureau of Police, Pennsylvania",Pennsylvania,,,,"K9 Fritz was killed after falling four stories while searching for a burglary suspect.K9 Fritz and his partner had answered a call of a suspected burglary in progress at a building in the 1400 block of Western Avenue on the city's north side. Fritz, his partner, and other officers had entered the building's roof through a skylight to search the roof. K9 Fritz lunged towards a noise he herd on the roof and fell four stories.Fritz was found unconscious in an alley by other officers and rushed to a veterinary hospital where he was pronounced dead."
K9,Bandit,German Shepherd,Male,5.0,1975-08-05,Tuesday,Gunfire,"Fairfax County Police Department, Virginia",Virginia,"3 years, 6 months",Handgun,,"K9 Bandit was shot and killed while attempting an apprehension following a vehicle pursuit of a stolen car.Officers attempted to the vehicle in the area of Route 1 and Giles Run Road, but the vehicle fled southbound into the Woodbridge area of Prince William County. The occupants abandoned the vehicle at Railroad Street and fled on foot in a residential area. K9 Bandit was released to attempt an apprehension but was shot multiple times. Officers located K9 Bandit approximately 100 yards from where he was released.He was taken to a veterinary hospital where he died several hours later."
K9,Mac,Unknown Breed,,,1976-08-01,Sunday,Heatstroke,"Miami Police Department, Florida",Florida,,,,"K9 Mac and K9 Dorn, of the Miami-Dade Police Department, both died from heat exhaustion during a search for a violent robbery subject in the area of NW 167 Street and 57 Avenue.As K9 Dorn and his handler searched a wooded area they encountered K9 Mac's handler, who was returning to his patrol car because Mac was displaying signs of heat exhaustion. Both handlers returned to their patrol cars where Mac suddenly collapsed. Dorn was placed in the patrol car where he became unresponsive as well.Dorn was transported to a local fire station where rescue efforts were unsuccessful."
K9,Dorn,Unknown Breed,,,1976-08-01,Sunday,Heatstroke,"Miami-Dade Police Department, Florida",Florida,,,,"K9 Dorn and K9 Mac, of the Miami Police Department, both died from heat exhaustion during a search for a violent robbery subject in the area of NW 167 Street and 57 Avenue.As K9 Dorn and his handler searched a wooded area they encountered K9 Mac's handler, who was returning to his patrol car because Mac was displaying signs of heat exhaustion. Both handlers returned to their patrol cars where Mac suddenly collapsed. Dorn was placed in the patrol car where he became unresponsive as well.Dorn was transported to a local fire station where rescue efforts were unsuccessful."
K9,Caesar,German Shepherd,Male,,1976-04-17,Saturday,Struck by vehicle,"Meriden Police Department, Connecticut",Connecticut,"1 year, 6 months",,,K9 Caesar was struck and killed by a vehicle while attempting to come to the assistance of his handler who was struggling with a suspect on Research Parkway.The handler and other officers had gone to the area as the result of illegal drag racing on the roadway. The handler was attempting to arrest a man who started to resist. Caesar jumped from the patrol car to come to his aid but was struck by a passing car.K9 Caesar had served with the Meriden Police Department for 1-1/2 years.
K9,Sam,Unknown Breed,,,1977-01-01,Saturday,Poisoned,"Maricopa County Sheriff's Office, Arizona",Arizona,,Poison,,K-9 Sam was poisoned while in the backyard of his residence.  The suspect knew that Sam was a police dog due to the Sheriff's vehicle being parked out in front of the house.
K9,Max,German Shepherd,Male,2.0,1977-06-14,Tuesday,Gunfire,"Dickson Police Department, Tennessee",Tennessee,7 months,Gun; Unknown type,Shot and killed,"K9 Max and Deputy Sheriff Robert Mayo, of the Dickson County Sheriff's Office, were shot and killed while attempting to arrest two escapees, a man and woman, from the Dickson County Jail. The male was a fugitive after having previously escaped from a jail in Connecticut while being held on an attempted murder charge. After escaping from the Dickson County Jail the couple broke into a home and robbed the owner before stealing a car. A Dickson County constable found the couple driving the car on Highway 49 the following day and initiated a pursuit.The pursuit ended when the vehicle crashed as it rounded a curve approximately four miles east of Charlotte. During the ensuing manhunt, K9 Max was fatally shot after locating the man hiding in a tree. Deputy Mayo heard the shots and was shot in the neck as he neared the area.The subject was able to escape but was later shot and killed during a shootout with members of the Connecticut State Police."
K9,King,German Shepherd,Male,4.0,1978-05-22,Monday,Gunfire,"Clarksville Police Department, Tennessee",Tennessee,,Shotgun,,"K9 King was shot and killed while protecting his handler after responding to a burglary in progress call.As his handler approached the home the suspect emerged from a doorway, raised a shotgun, and fired. King immediately sprang up in front of his handler and took the entire blast."
K9,Baron,German Shepherd,Male,4.0,1978-11-06,Monday,Automobile crash,"Orlando Police Department, Florida",Florida,3 years,,,K9 Baron was killed in a vehicle crash at the intersection of Church Street and Magnolia Avenue.Another vehicle ran a red light and struck the patrol car that Baron was riding in. The driver of the other vehicle was charged with violating right-of-way.K9 Baron had served with the Orlando Police Department for three years.
K9,King,German Shepherd,Male,,1978-05-03,Wednesday,Exposure to toxins,"Chicago Police Department, Illinois",Illinois,2 years,,,K9 King after ingesting food that had been laced with rodent poison while conducting a search.K9 King had served with the Chicago Police Department for two years.
K9,Sieger,German Shepherd,Male,9.0,1979-05-14,Monday,Exposure to toxins,"Chicago Police Department, Illinois",Illinois,"7 years, 7 months",,,"K9 Sieger died after ingesting the rodent poison sodium fluoroacetate while searching a liquor store at 45 East Garfield Boulevard.He and his handler had been dispatched to the location for a burglar alarm and located an open door. K9 Sieger made his way downstairs during the search and began to eat chunks of bread on the floor. The bread had been laced with the rodent poison, causing Sieger to become ill. He was immediately taken to a local animal hospital where he died.K9 had served with the Chicago Police Department for 7-1/2 years and was only six months short of being retired."
K9,Magnum,German Shepherd,Male,,1979-07-28,Saturday,Struck by vehicle,"Saddle River Police Department, New Jersey",New Jersey,,,,K9 Magnum was struck and killed by a car while tracking a larceny suspect.Magnum had successfully located the subject who was hiding in an overgrown area near the Saddle River. The subject fled across the river with Magnum's handler in pursuit.Magnum attempted to follow his handler and the subject but became separated and was struck by a vehicle on West Saddle River Road.
K9,Vem,Unknown Breed,Male,,1979-07-02,Monday,Stabbed,"Napa Police Department, California",California,,,,"K9 Vem was died from a knife wound suffered the previous day while protecting his handler.Vem's handler was attempting to take a vandalism suspect into custody at a local apartment complex. As the officer entered the apartment the man lunged at him with a knife, but K9 Vem immediately took action to protect his handler. Vem was slashed across the throat and died the following day."
K9,Beau,German Shepherd,Male,2.0,1979-04-17,Tuesday,Gunfire,"Altoona Police Department, Pennsylvania",Pennsylvania,,Handgun; .357 caliber,Shot and wounded,K9 Beau succumbed to a gunshot wounds sustained two weeks earlier while attempting a take down on an armed hostage taker.The subject was wanted for the wounding of a Hollidaysburg police officer four months earlier and had been at a home in Altoona. As officers surrounded the house the man exited holding a female hostage. As the pair walked up the woman tripped and fell out of the hostage taker's grasp. K9 Beau was released but was shot as he attempted to bite the subject. The man then grabbed the female again and was able to walk several blocks before releasing her and taking a boy as a hostage.The man then let the boy go when he began crying. The subject was shot and taken into custody when he attempted to run away.K9 Beau was flown to an emergency veterinary hospital in Philadelphia but had to be euthanized when it was determined that his spinal cord had been severed.
K9,Sarge,German Shepherd,,,1979-01-18,Thursday,Stabbed,"Garrett County Sheriff's Office, Maryland",Maryland,,Edged weapon; Sword,Sentenced to life,"K9 Sarge was killed with a samurai sword after he and his handler, Deputy Sheriff David Livengood, responded to a burglary call at the Army - Navy store in Oakland, Maryland.After shooting Deputy Livengood, the two suspects killed his canine, Sarge, with a samurai sword. The suspects fled in Deputy Livengood's cruiser. A short time later they tied up a family near Dear Park and stole their car. Later that day they were captured by state police near Morgantown, West Virginia.Both suspects were convicted of first degree murder. One was sentenced to death but later his sentence was commuted to life. He died in prison on October 26, 2006. The other suspect was sentenced to life. On November 22, 2011, his murder conviction was reversed. He remains in custody pending further proceedings. "
